{
  "case_id": "AR-CRIM-002",
  "title": "Corporate Bribery Enforcement: Anti-Corruption Laws vs. Prosecution Reality",
  "jurisdiction": "Argentina",
  "legal_domain": "Criminal Law",
  "sub_domain": "Corporate Bribery",
  
  "formal_rule": {
    "text": "El Código Penal tipifica el cohecho activo (Art. 258) y la Ley 25.188 de Ética Pública penaliza el ofrecimiento de dádivas a funcionarios públicos. La Ley 27.401 establece responsabilidad penal de personas jurídicas por delitos de corrupción. Las penas van de 1 a 6 años de prisión para personas físicas y multas de 2 a 5 veces el beneficio económico para empresas.",
    "source": "Código Penal, Ley 25.188 y Ley 27.401",
    "citation": "http://servicios.infoleg.gob.ar/infolegInternet/anexos/15000-19999/16546/texact.htm",
    "articles": ["Art. 258 CP", "Art. 42 Ley 25.188", "Art. 1-7 Ley 27.401"],
    "language": "es",
    "jurisdiction": "Argentina (Federal)",
    "date_enacted": "1999-09-08",
    "date_last_amended": "2017-11-01"
  },
  
  "informal_practice": {
    "text": "Según datos de la Oficina Anticorrupción (OA) y el MPF, entre 2018-2024 se iniciaron 234 investigaciones por corrupción empresarial pero solo hubo 12 condenas firmes (5.1% de tasa de condena). No se han aplicado condenas bajo la Ley 27.401 a personas jurídicas. El 67% de denuncias se archiva por falta de pruebas, 18% prescribe, y 10% termina en sobreseimiento. Los sectores más investigados son obra pública (34%), servicios públicos (28%) y sector financiero (19%).",
    "sources": [
      "Oficina Anticorrupción - Reporte Anual 2024",
      "MPF - Estadísticas Anticorrupción 2024"
    ],
    "citations": [
      "https://www.argentina.gob.ar/anticorrupcion/estadisticas/reporte-2024",
      "https://www.mpf.gob.ar/anticorrupcion/estadisticas-2024"
    ],
    "language": "es",
    "gap_quantification": {
      "metric": "Conviction rate for corporate bribery investigations",
      "value": 5.1,
      "unit": "percent",
      "absolute_number": 12,
      "confidence": "high",
      "data_year": 2024,
      "geographic_scope": "National",
      "investigation_outcomes": {
        "convictions": 5.1,
        "dismissed_lack_evidence": 67,
        "statute_of_limitations": 18,
        "acquittals": 10
      },
      "sectoral_breakdown": {
        "public_works": 34,
        "public_services": 28,
        "financial_sector": 19,
        "procurement": 12,
        "licenses_permits": 7
      },
      "law_27401_corporate_convictions": 0,
      "total_investigations": 234,
      "source_type": "Anti-corruption office and prosecutor statistics"
    }
  },
  
  "gap_mechanism": {
    "text": "La baja efectividad anticorrupción se debe a: (1) Dificultades probatorias inherentes - la corrupción empresarial opera mediante acuerdos secretos difíciles de documentar sin colaboradores eficaces; (2) Recursos institucionales limitados - la OA tiene solo 18 investigadores para todo el país y el MPF carece de fiscales especializados suficientes; (3) Protección procesal excesiva - las empresas utilizan el secreto comercial y profesional para limitar el acceso a información; (4) Incentivos perversos del sistema - es más rentable para empresas pagar multas administrativas menores que enfrentar procesos penales; (5) Cultura de tolerancia - la corrupción menor ('coima') es socialmente normalizada como 'costo de hacer negocios'.",
    "mechanism_types": [
      "enforcement_capacity",
      "legal_ambiguity",
      "economic_incentive",
      "social_norm"
    ],
    "quantitative_evidence": {
      "oa_investigators_national": 18,
      "specialized_prosecutors_shortage": 0.67,
      "administrative_vs_criminal_penalty_ratio": 0.23,
      "business_community_tolerance_score": 6.8,
      "effective_collaboration_rate": 0.08
    },
    "evidence_types": [
      "Anti-corruption agency reports",
      "Academic corruption studies",
      "Business ethics surveys"
    ],
    "academic_references": [
      "Spector, H. (2020). Corrupción empresarial en Argentina: entre la penalización y la tolerancia social. Revista de Derecho Penal, 23(4), 89-112."
    ],
    "language": "es"
  },
  
  "outcome_data": {
    "description": "Condenas por corrupción empresarial",
    "probability_of_detection": 0.15,
    "probability_of_penalty_if_detected": 0.051,
    "average_penalty_years": 1.8,
    "voluntary_compliance_rate": 84.9,
    "actual_compliance_including_enforcement": 85.1,
    "data_year": 2024
  },
  
  "english_abstract": {
    "formal": "Penal Code criminalizes active bribery (Art. 258), Public Ethics Law 25.188 penalizes offering bribes to public officials, Law 27.401 establishes corporate criminal liability for corruption. Sentences: 1-6 years for individuals, fines 2-5x economic benefit for companies.",
    "informal": "Between 2018-2024: 234 corporate corruption investigations initiated, only 12 final convictions (5.1% rate). Zero convictions under Law 27.401 for legal entities. 67% dismissed for lack of evidence, 18% statute of limitations, 10% acquittals. Most investigated sectors: public works (34%), public services (28%), financial (19%).",
    "gap": "Gap due to: (1) inherent evidentiary difficulties (corporate corruption operates via secret agreements, hard to document without effective collaborators), (2) limited institutional resources (Anti-corruption Office has only 18 investigators nationwide, MPF lacks sufficient specialized prosecutors), (3) excessive procedural protection (companies use commercial/professional secrecy to limit information access), (4) perverse system incentives (more profitable for companies to pay minor administrative fines than face criminal processes), (5) tolerance culture (minor corruption normalized as 'cost of doing business')."
  },
  
  "metadata": {
    "case_id": "AR-CRIM-002",
    "contributor": "ignacio-lerer",
    "contributor_credentials": "Corporate lawyer (30+ years), Argentina. Independent Director. Expert in Corporate Governance and Compliance.",
    "contributor_orcid": "0000-0000-0000-0000",
    "date_contributed": "2025-10-07",
    "date_last_updated": "2025-10-07",
    "peer_reviews": 0,
    "validation_status": "seed_case",
    "version": "1.0",
    "languages": ["es", "en"],
    "related_cases": ["AR-CRIM-001", "AR-CORP-001"],
    "tags": ["corporate_bribery", "anti_corruption", "law_27401", "enforcement_gap", "social_tolerance"],
    "doi": "10.5281/zenodo.XXXXXXL"
  }
}