{
  "case_id": "AR-FAM-001",
  "title": "Child Support Enforcement: Legal Obligations vs. Actual Payment Compliance",
  "jurisdiction": "Argentina",
  "legal_domain": "Family Law",
  "sub_domain": "Child Support",
  
  "formal_rule": {
    "text": "El Código Civil y Comercial (Art. 658-676) establece la obligación alimentaria de ambos progenitores hacia los hijos menores de edad. La cuota se fija judicialmente considerando las necesidades del alimentado y las posibilidades económicas del alimentante. El incumplimiento puede derivar en medidas como embargo de sueldos, inhabilitación para conducir, o prisión por desobediencia judicial.",
    "source": "Código Civil y Comercial de la Nación",
    "citation": "http://servicios.infoleg.gob.ar/infolegInternet/anexos/235000-239999/235975/norma.htm",
    "articles": ["Art. 658-676", "Art. 550-552"],
    "language": "es",
    "jurisdiction": "Argentina (Federal)",
    "date_enacted": "2014-10-01",
    "date_last_amended": "2014-10-01"
  },
  
  "informal_practice": {
    "text": "Según datos del Registro Nacional de Deudores Alimentarios Morosos (REDAM) y encuestas judiciales, el 58% de obligados al pago de cuota alimentaria incumple total o parcialmente con sus obligaciones. Solo el 42% paga regularmente la cuota fijada judicialmente. Entre los incumplidores: 34% no paga nada, 24% paga parcialmente (<50% de la cuota), y 18% paga irregularmente. Los tiempos promedio de ejecución judicial son 2.3 años.",
    "sources": [
      "REDAM - Registro Nacional de Deudores Alimentarios - Estadísticas 2024",
      "Cámara Nacional de Apelaciones en lo Civil - Encuesta Familia 2024"
    ],
    "citations": [
      "https://www.argentina.gob.ar/redam/estadisticas-2024",
      "https://www.pjn.gov.ar/cncivil/estadisticas/familia-2024.pdf"
    ],
    "language": "es",
    "gap_quantification": {
      "metric": "Percentage of child support obligors in full compliance",
      "value": 42.0,
      "unit": "percent",
      "absolute_number": 680000,
      "confidence": "medium",
      "data_year": 2024,
      "geographic_scope": "National",
      "compliance_breakdown": {
        "full_regular_payment": 42,
        "no_payment": 34,
        "partial_payment_under_50": 24,
        "irregular_payment": 18
      },
      "enforcement_measures": {
        "wage_garnishment": 67,
        "asset_seizure": 23,
        "driving_license_suspension": 12,
        "imprisonment": 3
      },
      "average_execution_duration_years": 2.3,
      "total_obligors_estimated": 1619000,
      "source_type": "National registry and judicial survey"
    }
  },
  
  "gap_mechanism": {
    "text": "El incumplimiento alimentario se debe a: (1) Trabajo informal extendido - el 40% de obligados trabaja en negro, dificultando embargos salariales efectivos; (2) Movilidad geográfica - obligados cambian domicilio para evadir notificaciones, demandando nuevos trámites de localización; (3) Ocultamiento patrimonial - traspaso de bienes a terceros o cónyuges para evadir embargos; (4) Lentitud judicial - los procesos ejecutivos demoran 2.3 años promedio, durante los cuales se acumula la deuda; (5) Sanciones poco disuasivas - la prisión por desobediencia se aplica raramente (3% de casos) y por períodos cortos; (6) Capacidad de enforcement limitada - los juzgados de familia están sobrecargados con 240 expedientes promedio por juzgado.",
    "mechanism_types": [
      "enforcement_capacity",
      "economic_incentive",
      "administrative_burden",
      "social_norm"
    ],
    "quantitative_evidence": {
      "informal_work_percentage": 40,
      "address_change_evasion_rate": 0.28,
      "asset_hiding_percentage": 0.35,
      "execution_duration_years": 2.3,
      "imprisonment_application_rate": 0.03,
      "cases_per_family_court": 240
    },
    "evidence_types": [
      "Judicial statistics",
      "National registry data",
      "Academic family law studies"
    ],
    "academic_references": [
      "Grosman, C. P. (2021). El incumplimiento alimentario en Argentina: obstáculos procesales y sociales. Revista de Derecho de Familia, 45(2), 123-145."
    ],
    "language": "es"
  },
  
  "outcome_data": {
    "description": "Cumplimiento cuota alimentaria",
    "probability_of_detection": 0.73,
    "probability_of_penalty_if_detected": 0.67,
    "average_penalty_months": 4.2,
    "voluntary_compliance_rate": 42.0,
    "actual_compliance_including_enforcement": 49.8,
    "data_year": 2024
  },
  
  "english_abstract": {
    "formal": "Civil and Commercial Code (Art. 658-676) establishes alimentary obligation of both parents toward minor children. Amount judicially fixed considering child's needs and parent's economic capacity. Non-compliance may result in wage garnishment, driving license suspension, or imprisonment for judicial disobedience.",
    "informal": "58% of child support obligors fail to fully comply with payments. Only 42% pay regularly per court order. Among non-compliers: 34% pay nothing, 24% pay partially (<50%), 18% pay irregularly. Average judicial execution: 2.3 years.",
    "gap": "Gap due to: (1) extensive informal work (40% of obligors work 'off-books', hindering effective wage garnishment), (2) geographic mobility (obligors change address to evade notifications, requiring new location procedures), (3) asset concealment (transfer to third parties/spouses to evade seizure), (4) judicial delays (execution processes take 2.3 years average while debt accumulates), (5) weak sanctions (imprisonment rarely applied - 3% of cases, short periods), (6) limited enforcement capacity (family courts overburdened with 240 cases average per court)."
  },
  
  "metadata": {
    "case_id": "AR-FAM-001",
    "contributor": "ignacio-lerer",
    "contributor_credentials": "Corporate lawyer (30+ years), Argentina. Independent Director. Expert in Corporate Governance and Compliance.",
    "contributor_orcid": "0000-0000-0000-0000",
    "date_contributed": "2026-02-01",
    "date_last_updated": "2026-02-01",
    "peer_reviews": 0,
    "validation_status": "seed_case",
    "version": "1.0",
    "languages": ["es", "en"],
    "related_cases": ["AR-FAM-002", "AR-LAB-001"],
    "tags": ["child_support", "family_law", "enforcement_gap", "informal_work", "judicial_execution"],
    "doi": "10.5281/zenodo.XXXXXXO"
  }
}